{
  "source": {
    "commit": "1358a48e9c23e257ae3357f6f645cb60a3610a7f",
    "file": "compose/material3/material3/src/commonMain/kotlin/androidx/compose/material3/LoadingIndicator.kt"
  },
  "lerp": "cubic(t)[k] = start[i][k] + (end[i][k] - start[i][k]) * t; draw cubics in order as one closed path",
  "notes": [
    "Pairs are Morph(a.normalized(), b.normalized()) from graphics-shapes 1.0.1; start = asCubics(0f), end = asCubics(1f).",
    "LoadingIndicator draws the morph path with startAngle = 0 (no path rotation), scales it by containerSize * scaleFactor, then translates so the path's bounds center sits on the container center (every frame).",
    "scaleFactor = calculateScaleFactor(polygons) * ActiveIndicatorScale; ActiveIndicatorScale = IndicatorSize 38dp / min(ContainerWidth 48dp, ContainerHeight 48dp).",
    "Indeterminate: morphProgress animates 0->1 with spring(dampingRatio 0.6, stiffness 200, visibilityThreshold 0.1) every 650 ms (MorphIntervalMillis); on finish index = (index+1) % 7, progress snaps to 0, morphRotationTargetAngle = (angle + 90) % 360 (initial 90). Draw rotation (degrees, clockwise, about container center) = progress*90 + morphRotationTargetAngle + globalRotation; globalRotation runs 0->360 linearly over 4666 ms, repeating.",
    "Determinate: sequence is not circular (1 morph). activeIndex = min(floor(n*progress), n-1); morph progress = (progress*n) % 1 (1 at progress 1). Draw rotation = -progress*180 degrees (counter-clockwise).",
    "Other material3 shape animation: button/icon-button press and toggle shapes (internal/AnimatedShape.kt) animate CornerBasedShape corner sizes, not RoundedPolygon Morphs; foundation MorphPolygonShape is a generic Shape wrapper. Only LoadingIndicator morphs MaterialShapes in material3 commonMain; those pairs are the only ones exported."
  ],
  "indeterminate": {
    "sequence": ["soft-burst", "cookie-9-sided", "pentagon", "pill", "sunny", "cookie-4-sided", "oval"],
    "circular": true,
    "shapesScaleFactor": 0.86558,
    "activeIndicatorScale": 0.79167,
    "drawScale": 0.68525,
    "pairs": [
      {
        "from": "soft-burst",
        "to": "cookie-9-sided",
        "start": [
          [0.15704,0.29236,0.18165,0.2863,0.19826,0.26333,0.19633,0.23807],
          [0.19633,0.23807,0.1959,0.23245,0.19547,0.22684,0.19504,0.22123],
          [0.19504,0.22123,0.19317,0.19691,0.19131,0.17259,0.18945,0.14826],
          [0.18945,0.14826,0.18651,0.10985,0.22501,0.08176,0.26069,0.09629],
          [0.26069,0.09629,0.28338,0.10552,0.30607,0.11476,0.32876,0.12399],
          [0.32876,0.12399,0.33404,0.12614,0.33931,0.12829,0.34459,0.13043],
          [0.34459,0.13043,0.36806,0.13999,0.395,0.13118,0.40828,0.1096],
          [0.40828,0.1096,0.41123,0.1048,0.41419,0.10001,0.41714,0.09522],
          [0.41714,0.09522,0.42993,0.07445,0.44271,0.05367,0.4555,0.0329],
          [0.4555,0.0329,0.4757,0.0001,0.52336,0,0.54369,0.03273],
          [0.54369,0.03273,0.55662,0.05354,0.56955,0.07434,0.58248,0.09515],
          [0.58248,0.09515,0.58548,0.09999,0.58849,0.10483,0.59149,0.10967],
          [0.59149,0.10967,0.60487,0.13119,0.63184,0.1399,0.65527,0.13025],
          [0.65527,0.13025,0.66048,0.1281,0.66568,0.12596,0.67089,0.12382],
          [0.67089,0.12382,0.69344,0.11453,0.716,0.10524,0.73855,0.09596],
          [0.73855,0.09596,0.77418,0.08129,0.81279,0.10922,0.81001,0.14765],
          [0.81001,0.14765,0.80823,0.17208,0.80646,0.19652,0.80469,0.22095],
          [0.80469,0.22095,0.80428,0.22663,0.80386,0.23231,0.80345,0.23799],
          [0.80345,0.23799,0.80162,0.26327,0.81833,0.28616,0.84295,0.29213],
          [0.84295,0.29213,0.84842,0.29346,0.85389,0.29478,0.85936,0.29611],
          [0.85936,0.29611,0.88307,0.30185,0.90678,0.3076,0.93049,0.31334],
          [0.93049,0.31334,0.96793,0.32241,0.98275,0.36771,0.95791,0.39716],
          [0.95791,0.39716,0.94211,0.41589,0.92631,0.43461,0.91052,0.45334],
          [0.91052,0.45334,0.90685,0.45769,0.90318,0.46204,0.8995,0.4664],
          [0.8995,0.4664,0.88316,0.48577,0.88322,0.51411,0.89964,0.53341],
          [0.89964,0.53341,0.90328,0.5377,0.90693,0.54199,0.91058,0.54628],
          [0.91058,0.54628,0.92638,0.56486,0.94218,0.58344,0.95799,0.60202],
          [0.95799,0.60202,0.98295,0.63137,0.96831,0.67673,0.9309,0.68595],
          [0.9309,0.68595,0.90712,0.69182,0.88333,0.69768,0.85954,0.70355],
          [0.85954,0.70355,0.85402,0.70491,0.84849,0.70627,0.84296,0.70764],
          [0.84296,0.70764,0.81835,0.7137,0.80174,0.73667,0.80367,0.76193],
          [0.80367,0.76193,0.8041,0.76755,0.80453,0.77316,0.80496,0.77877],
          [0.80496,0.77877,0.80683,0.80309,0.80869,0.82741,0.81055,0.85174],
          [0.81055,0.85174,0.81349,0.89015,0.77499,0.91824,0.73931,0.90372],
          [0.73931,0.90372,0.71134,0.89233,0.68338,0.88095,0.65541,0.86957],
          [0.65541,0.86957,0.63194,0.86001,0.605,0.86882,0.59172,0.8904],
          [0.59172,0.8904,0.57598,0.91597,0.56024,0.94153,0.5445,0.9671],
          [0.5445,0.9671,0.5367,0.97976,0.52482,0.98755,0.51199,0.99046],
          [0.51199,0.99046,0.49158,0.99509,0.46879,0.98737,0.45631,0.96727],
          [0.45631,0.96727,0.44037,0.94163,0.42444,0.91598,0.40851,0.89033],
          [0.40851,0.89033,0.39513,0.86881,0.36816,0.8601,0.34473,0.86975],
          [0.34473,0.86975,0.33952,0.8719,0.33432,0.87404,0.32911,0.87618],
          [0.32911,0.87618,0.30656,0.88547,0.284,0.89476,0.26145,0.90404],
          [0.26145,0.90404,0.22582,0.91871,0.18721,0.89078,0.18999,0.85235],
          [0.18999,0.85235,0.19177,0.82792,0.19354,0.80348,0.19531,0.77905],
          [0.19531,0.77905,0.19572,0.77337,0.19614,0.76769,0.19655,0.76201],
          [0.19655,0.76201,0.19838,0.73673,0.18167,0.71384,0.15705,0.70787],
          [0.15705,0.70787,0.15158,0.70654,0.14611,0.70522,0.14063,0.70389],
          [0.14063,0.70389,0.11693,0.69815,0.09322,0.6924,0.06951,0.68666],
          [0.06951,0.68666,0.03207,0.67759,0.01725,0.63229,0.04209,0.60284],
          [0.04209,0.60284,0.05789,0.58412,0.07369,0.56539,0.08948,0.54666],
          [0.08948,0.54666,0.09315,0.54231,0.09682,0.53796,0.1005,0.5336],
          [0.1005,0.5336,0.11684,0.51423,0.11678,0.48589,0.10036,0.46659],
          [0.10036,0.46659,0.09672,0.4623,0.09307,0.45801,0.08942,0.45372],
          [0.08942,0.45372,0.07362,0.43514,0.05782,0.41656,0.04201,0.39798],
          [0.04201,0.39798,0.01705,0.36863,0.03169,0.32327,0.0691,0.31405],
          [0.0691,0.31405,0.09288,0.30818,0.11667,0.30232,0.14046,0.29645],
          [0.14046,0.29645,0.14598,0.29509,0.15151,0.29373,0.15704,0.29236]
        ],
        "end": [
          [0.08935,0.31224,0.10988,0.29244,0.12441,0.26724,0.13127,0.23955],
          [0.13127,0.23955,0.13256,0.23433,0.13358,0.22903,0.13431,0.22366],
          [0.13431,0.22366,0.13713,0.20303,0.144,0.18388,0.15405,0.16693],
          [0.15405,0.16693,0.17157,0.13736,0.19876,0.11452,0.23091,0.10235],
          [0.23091,0.10235,0.24939,0.09535,0.26952,0.09188,0.29039,0.09269],
          [0.29039,0.09269,0.29587,0.0929,0.30133,0.09282,0.30674,0.09244],
          [0.30674,0.09244,0.3352,0.09047,0.36253,0.0805,0.38558,0.0637],
          [0.38558,0.0637,0.38992,0.06053,0.39411,0.05712,0.39813,0.05348],
          [0.39813,0.05348,0.41354,0.03949,0.43112,0.02923,0.44971,0.02271],
          [0.44971,0.02271,0.48214,0.01132,0.51765,0.0113,0.5501,0.02264],
          [0.5501,0.02264,0.56876,0.02916,0.5864,0.03944,0.60187,0.05348],
          [0.60187,0.05348,0.60593,0.05716,0.61017,0.0606,0.61456,0.0638],
          [0.61456,0.0638,0.63763,0.08058,0.66497,0.09051,0.69343,0.09245],
          [0.69343,0.09245,0.69879,0.09282,0.70419,0.0929,0.70961,0.09269],
          [0.70961,0.09269,0.73041,0.09189,0.75047,0.09533,0.7689,0.10228],
          [0.7689,0.10228,0.80107,0.1144,0.82828,0.13721,0.84585,0.16675],
          [0.84585,0.16675,0.85595,0.18374,0.86286,0.20296,0.86569,0.22366],
          [0.86569,0.22366,0.86643,0.22909,0.86747,0.23445,0.86878,0.23972],
          [0.86878,0.23972,0.87566,0.2674,0.89022,0.29259,0.91078,0.31237],
          [0.91078,0.31237,0.91465,0.31609,0.91873,0.31963,0.92302,0.32295],
          [0.92302,0.32295,0.93947,0.3357,0.95262,0.35123,0.96228,0.3684],
          [0.96228,0.3684,0.97912,0.39837,0.98531,0.43333,0.97977,0.46726],
          [0.97977,0.46726,0.97659,0.48676,0.96953,0.50593,0.9584,0.5236],
          [0.9584,0.5236,0.95547,0.52824,0.95282,0.53301,0.95044,0.53789],
          [0.95044,0.53789,0.93792,0.56352,0.93288,0.59217,0.93591,0.62054],
          [0.93591,0.62054,0.93648,0.62588,0.93734,0.63121,0.93849,0.63651],
          [0.93849,0.63651,0.94289,0.65686,0.94299,0.67721,0.93934,0.69657],
          [0.93934,0.69657,0.93299,0.73035,0.91525,0.76111,0.88921,0.78354],
          [0.88921,0.78354,0.87423,0.79644,0.85651,0.80658,0.83661,0.81296],
          [0.83661,0.81296,0.83139,0.81463,0.82629,0.81658,0.82133,0.81879],
          [0.82133,0.81879,0.79527,0.83037,0.77299,0.84909,0.75708,0.87276],
          [0.75708,0.87276,0.75408,0.87722,0.75131,0.88186,0.74879,0.88666],
          [0.74879,0.88666,0.73908,0.90507,0.72607,0.92072,0.71084,0.93321],
          [0.71084,0.93321,0.6931,0.94776,0.67234,0.95801,0.65027,0.96336],
          [0.65027,0.96336,0.64226,0.9653,0.63407,0.96659,0.62579,0.96721],
          [0.62579,0.96721,0.61565,0.96796,0.60537,0.9677,0.59511,0.96636],
          [0.59511,0.96636,0.58675,0.96527,0.5784,0.96347,0.57014,0.96093],
          [0.57014,0.96093,0.56584,0.9596,0.56157,0.95807,0.55733,0.95634],
          [0.55733,0.95634,0.55059,0.95359,0.5437,0.95134,0.53672,0.9496],
          [0.53672,0.9496,0.52916,0.94771,0.52149,0.94642,0.51378,0.94571],
          [0.51378,0.94571,0.49508,0.94401,0.47615,0.94578,0.45796,0.95103],
          [0.45796,0.95103,0.4528,0.95252,0.44769,0.95429,0.44267,0.95634],
          [0.44267,0.95634,0.4234,0.96421,0.40338,0.96784,0.38368,0.96761],
          [0.38368,0.96761,0.3493,0.96722,0.31593,0.9551,0.28932,0.93334],